<?xml version="1.0" encoding="UTF-8"?>

<!--
Copyright (C) 2018 BlobCity Inc

This program is free software: you can redistribute it and/or modify
it under the terms of the GNU Affero General Public License as published
by the Free Software Foundation, either version 3 of the License, or
(at your option) any later version.

This program is distributed in the hope that it will be useful,
but WITHOUT ANY WARRANTY; without even the implied warranty of
MERCHANTABILITY or FITNESS FOR A PARTICULAR PURPOSE.  See the
GNU Affero General Public License for more details.
You should have received a copy of the GNU Affero General Public License
along with this program.  If not, see <http://www.gnu.org/licenses/>.
-->

<!--
This file has a valid DTD queryCode that needs to be maintained (since XPath parses this file and any contract change requires a code change). Ensure the DTD is up to date.

Author: javatarz (Karun Japhet)
-->
<!DOCTYPE config SYSTEM "test.dtd">
<config>
    <factories>
        <name id="key1">Value 1</name>
        <name id="key1">Value 3</name>
        <name id="key2">Value 5</name>
    </factories>
    
    <ports>
        <port id="app1">1</port>
        <port id="app2">2</port>
    </ports>

    <hosts>
        <host id="app1">http://blobcity.com</host>
        <host id="app2">http://blobcity.org</host>
    </hosts>

    <resources>
        <package id="pkg1">val-1.0</package>
        <package id="pkg1">val-1.5</package>
        <package id="pkg2">val-2</package>
    </resources>

    <inject>
        <class>val1</class>
        <class>val2</class>
    </inject>
</config>